[
  {
    "id": "openai-gpt-5-5",
    "family_id": "openai-gpt5x",
    "provider_id": "openai",
    "name": "GPT-5.5",
    "name_cn": "GPT-5.5",
    "model_id": "gpt-5.5",
    "one_liner_cn": "OpenAI 当前旗舰，强推理与编码，1M 上下文。",
    "context_window": 1050000,
    "max_output_tokens": 128000,
    "input_price_per_mtok": 5,
    "output_price_per_mtok": 30,
    "currency": "USD",
    "vision_support": true,
    "open_weight": false,
    "speed_tier": "fast",
    "model_type": [
      "Chat",
      "Vision",
      "Reasoning",
      "Coding",
      "Agent"
    ],
    "capabilities": {
      "reasoning": {
        "tier": "high",
        "basis": "官方推理档 xhigh；1M 上下文，复杂多步问题。"
      },
      "coding": {
        "tier": "high",
        "basis": "官方定位编码与专业工作。"
      },
      "agent": {
        "tier": "high",
        "basis": "支持 Computer use / 工具调用。"
      },
      "knowledge": {
        "tier": "high",
        "basis": "知识截止 2025-12。"
      },
      "multilingual": {
        "tier": "high",
        "basis": "多语言支持。"
      }
    },
    "best_for": [
      "reasoning",
      "coding",
      "agent",
      "long_context"
    ],
    "avoid_for": [
      "low_cost"
    ],
    "release_date": "2026",
    "source_url": "https://platform.openai.com/docs/pricing",
    "verified": true,
    "verified_date": "2026-08-08",
    "aliases": [
      "gpt-5.5",
      "OpenAI",
      "ChatGPT"
    ],
    "cost_tier": "production",
    "role": "reasoning",
    "access_types": [
      "official_api"
    ],
    "status": "active",
    "data_quality_score": 85,
    "data_source": "official",
    "last_verified_at": "2026-08-05",
    "price_model": "per_token",
    "benchmarks": []
  },
  {
    "id": "openai-gpt-5-4",
    "family_id": "openai-gpt5x",
    "provider_id": "openai",
    "name": "GPT-5.4",
    "name_cn": "GPT-5.4",
    "model_id": "gpt-5.4",
    "one_liner_cn": "更实惠的编码与专业工作模型，1M 上下文。",
    "context_window": 1050000,
    "max_output_tokens": 128000,
    "input_price_per_mtok": 2.5,
    "output_price_per_mtok": 15,
    "currency": "USD",
    "vision_support": true,
    "open_weight": false,
    "speed_tier": "fast",
    "model_type": [
      "Chat",
      "Vision",
      "Reasoning",
      "Coding",
      "Agent"
    ],
    "capabilities": {
      "reasoning": {
        "tier": "high",
        "basis": "官方推理档 high；编码定位。"
      },
      "coding": {
        "tier": "high",
        "basis": "面向专业编码工作。"
      },
      "agent": {
        "tier": "medium",
        "basis": "支持工具调用。"
      },
      "knowledge": {
        "tier": "high",
        "basis": "知识截止 2025-08。"
      },
      "multilingual": {
        "tier": "high",
        "basis": "多语言支持。"
      }
    },
    "best_for": [
      "coding",
      "agent",
      "chat"
    ],
    "avoid_for": [
      "low_cost"
    ],
    "release_date": "2026",
    "source_url": "https://platform.openai.com/docs/pricing",
    "verified": true,
    "verified_date": "2026-08-08",
    "aliases": [
      "gpt-5.4",
      "OpenAI",
      "ChatGPT"
    ],
    "cost_tier": "production",
    "role": "reasoning",
    "access_types": [
      "official_api"
    ],
    "status": "active",
    "data_quality_score": 85,
    "data_source": "official",
    "last_verified_at": "2026-08-05",
    "price_model": "per_token",
    "benchmarks": []
  },
  {
    "id": "openai-gpt-5-4-mini",
    "family_id": "openai-gpt5x",
    "provider_id": "openai",
    "name": "GPT-5.4 mini",
    "name_cn": "GPT-5.4 mini",
    "model_id": "gpt-5.4-mini",
    "one_liner_cn": "最强 mini 型号，适合编码、计算机使用与子代理。",
    "context_window": 400000,
    "max_output_tokens": 128000,
    "input_price_per_mtok": 0.75,
    "output_price_per_mtok": 4.5,
    "currency": "USD",
    "vision_support": true,
    "open_weight": false,
    "speed_tier": "faster",
    "model_type": [
      "Chat",
      "Vision",
      "Reasoning",
      "Coding",
      "Agent"
    ],
    "capabilities": {
      "reasoning": {
        "tier": "medium",
        "basis": "mini 档推理弱于旗舰。"
      },
      "coding": {
        "tier": "medium",
        "basis": "官方强调编码与子代理。"
      },
      "agent": {
        "tier": "medium",
        "basis": "适合子代理场景。"
      },
      "knowledge": {
        "tier": "medium",
        "basis": "知识截止 2025-08。"
      },
      "multilingual": {
        "tier": "high",
        "basis": "多语言支持。"
      }
    },
    "best_for": [
      "low_cost",
      "coding",
      "agent"
    ],
    "avoid_for": [],
    "release_date": "2026",
    "source_url": "https://platform.openai.com/docs/pricing",
    "verified": true,
    "verified_date": "2026-08-05",
    "aliases": [
      "gpt-5.4-mini",
      "OpenAI",
      "ChatGPT"
    ],
    "cost_tier": "production",
    "role": "reasoning",
    "access_types": [
      "official_api"
    ],
    "status": "active",
    "data_quality_score": 85,
    "data_source": "official",
    "last_verified_at": "2026-08-05",
    "price_model": "per_token",
    "benchmarks": []
  },
  {
    "id": "openai-gpt-5-4-nano",
    "family_id": "openai-gpt5x",
    "provider_id": "openai",
    "name": "GPT-5.4 nano",
    "name_cn": "GPT-5.4 nano",
    "model_id": "gpt-5.4-nano",
    "one_liner_cn": "最便宜最快的型号，适合大规模简单任务。",
    "context_window": 400000,
    "max_output_tokens": 128000,
    "input_price_per_mtok": 0.2,
    "output_price_per_mtok": 1.25,
    "currency": "USD",
    "vision_support": true,
    "open_weight": false,
    "speed_tier": "fastest",
    "model_type": [
      "Chat",
      "Vision",
      "Coding"
    ],
    "capabilities": {
      "reasoning": {
        "tier": "low",
        "basis": "nano 档定位简单任务。"
      },
      "coding": {
        "tier": "low",
        "basis": "能力最低档。"
      },
      "agent": {
        "tier": "low",
        "basis": "不面向 agent。"
      },
      "knowledge": {
        "tier": "low",
        "basis": "简单问答。"
      },
      "multilingual": {
        "tier": "high",
        "basis": "多语言支持。"
      }
    },
    "best_for": [
      "low_cost",
      "chat"
    ],
    "avoid_for": [
      "reasoning",
      "coding"
    ],
    "release_date": "2026",
    "source_url": "https://platform.openai.com/docs/pricing",
    "verified": true,
    "verified_date": "2026-08-05",
    "aliases": [
      "gpt-5.4-nano",
      "OpenAI",
      "ChatGPT"
    ],
    "cost_tier": "cost_effective",
    "role": "coding",
    "access_types": [
      "official_api"
    ],
    "status": "active",
    "data_quality_score": 85,
    "data_source": "official",
    "last_verified_at": "2026-08-05",
    "price_model": "per_token",
    "benchmarks": []
  },
  {
    "id": "openai-gpt-5-5-pro",
    "family_id": "openai-gpt5x",
    "provider_id": "openai",
    "name": "GPT-5.5 Pro",
    "name_cn": "GPT-5.5 Pro",
    "model_id": "gpt-5.5-pro",
    "one_liner_cn": "高推理投入的 Pro 版，复杂任务更强但更慢更贵。",
    "context_window": 1050000,
    "max_output_tokens": 128000,
    "input_price_per_mtok": 30,
    "output_price_per_mtok": 180,
    "currency": "USD",
    "vision_support": true,
    "open_weight": false,
    "speed_tier": "slow",
    "model_type": [
      "Chat",
      "Vision",
      "Reasoning",
      "Coding",
      "Agent"
    ],
    "capabilities": {
      "reasoning": {
        "tier": "highest",
        "basis": "Pro = 最高推理投入。"
      },
      "coding": {
        "tier": "high",
        "basis": "专业编码。"
      },
      "agent": {
        "tier": "high",
        "basis": "工具调用。"
      },
      "knowledge": {
        "tier": "high",
        "basis": "知识截止 2025-12。"
      },
      "multilingual": {
        "tier": "high",
        "basis": "多语言支持。"
      }
    },
    "best_for": [
      "reasoning"
    ],
    "avoid_for": [
      "low_cost"
    ],
    "release_date": "2026",
    "source_url": "https://platform.openai.com/docs/pricing",
    "verified": true,
    "verified_date": "2026-08-08",
    "aliases": [
      "gpt-5.5-pro",
      "OpenAI",
      "ChatGPT"
    ],
    "cost_tier": "production",
    "role": "reasoning",
    "access_types": [
      "official_api"
    ],
    "status": "active",
    "data_quality_score": 85,
    "data_source": "official",
    "last_verified_at": "2026-08-05",
    "price_model": "per_token",
    "benchmarks": []
  },
  {
    "id": "anthropic-fable-5",
    "family_id": "anthropic-claude",
    "provider_id": "anthropic",
    "name": "Claude Fable 5",
    "name_cn": "Claude Fable 5",
    "model_id": "claude-fable-5",
    "one_liner_cn": "Anthropic 最强广泛发布模型，面向长程 Agent。",
    "context_window": 1000000,
    "max_output_tokens": 128000,
    "input_price_per_mtok": 10,
    "output_price_per_mtok": 50,
    "currency": "USD",
    "vision_support": true,
    "open_weight": false,
    "speed_tier": "slower",
    "model_type": [
      "Chat",
      "Vision",
      "Reasoning",
      "Coding",
      "Agent"
    ],
    "capabilities": {
      "reasoning": {
        "tier": "highest",
        "basis": "官方最強广泛发布模型。"
      },
      "coding": {
        "tier": "highest",
        "basis": "长程 agentic coding。"
      },
      "agent": {
        "tier": "highest",
        "basis": "面向长程 agent。"
      },
      "knowledge": {
        "tier": "high",
        "basis": "知识截止 2026-01。"
      },
      "multilingual": {
        "tier": "high",
        "basis": "多语言支持。"
      }
    },
    "best_for": [
      "agent",
      "reasoning",
      "coding",
      "long_context"
    ],
    "avoid_for": [
      "low_cost"
    ],
    "release_date": "2026-06",
    "source_url": "https://docs.anthropic.com/en/docs/about-claude/models",
    "verified": true,
    "verified_date": "2026-08-05",
    "aliases": [
      "claude-fable-5",
      "Anthropic",
      "Claude"
    ],
    "cost_tier": "production",
    "role": "reasoning",
    "access_types": [
      "official_api"
    ],
    "status": "active",
    "data_quality_score": 85,
    "data_source": "official",
    "last_verified_at": "2026-08-05",
    "price_model": "per_token",
    "benchmarks": []
  },
  {
    "id": "anthropic-opus-5",
    "family_id": "anthropic-claude",
    "provider_id": "anthropic",